{"agent":{"activeTools":["read","bash","edit","write","grep","find","ls","game_capabilities","game_launch","game_status","game_stop","game_query","game_checkpoint_create","game_checkpoint_restore","game_fork","game_trace_create","game_trace_replay","game_compare"],"attemptOrdinal":1,"hostModelNetworkPolicy":"provider_only","loopStatus":"completed","model":"gpt-5.6-luna","provider":"openai-codex","requestedTaskSandboxNetworkMode":"denied","taskCredentialMountCountMaximum":0,"thinkingLevel":"max","totalToolCallCount":37,"turnCount":1},"claimsExcluded":["correctness","independent_acceptance","intelligent_diagnosis","causality","generalization","reliability","success_rate","relative_advantage","arbitrary_project_support","root_cause_correctness"],"cleanup":{"rawSha256":"bf57f63a862e8253d672beb57f4a8c53beba371e4d1e7d3a26368b40b4d77343","relativePath":"cleanup-receipt.json"},"evidenceKind":"chronorift-m5-public-exposed-behavior-change-conformance","executions":{"baseline":{"build":{"rawSha256":"08731d6e9083030b3a761c75ccf6bb27e0bd7fe32e898183fa253a05dc2ebad5","relativePath":"runtime-records/baseline/build.json"},"events":{"rawSha256":"4ecd7f62fb4fbf6a29ce18a0d6e655fd665010f56f3ed26afe853620b70081df","relativePath":"runtime-records/baseline/events.jsonl"},"execution":{"rawSha256":"3963f30bb5103418ec47dda33492d3bce03b570abf76fd734422a18dc4975405","relativePath":"runtime-records/baseline/execution.json"},"executionSeal":{"rawSha256":"ee11f7a635785cc342c6f3b8f53221602d59112dff0f16a572a35d89455bc176","relativePath":"runtime-records/baseline/execution-seal.json"},"expectedSourceHash":"3e8bd6478d53586284010da38959005e2a377ef6277b2a838ecb1538abc096e8","runtime":{"rawSha256":"d6d52df0138a79d5879fd2c4dd3b5fbdec460c42e5df8742b85a1d157387d6de","relativePath":"runtime-records/baseline/runtime.json"}},"candidate":{"build":{"rawSha256":"f1182404e65064bd77763d009172aa7d8d4e63b5e5be89fc6273c0d716fdffd9","relativePath":"runtime-records/candidate/build.json"},"events":{"rawSha256":"ef749327a492e301faa2a9100717497623d0df2bdfc717d891f1a1def4a21a8b","relativePath":"runtime-records/candidate/events.jsonl"},"execution":{"rawSha256":"9b9c48c99791b117236b4eea60ad9a98ef16f2438ce377fe86820d2e69413c6a","relativePath":"runtime-records/candidate/execution.json"},"executionSeal":{"rawSha256":"a495af3c9365c00087121cd12e9466c9d5c2013a76494aa7a9480041d6a76372","relativePath":"runtime-records/candidate/execution-seal.json"},"expectedSourceHash":"92bda3131e95e5db996db13efbd2758b4d14c50846079cde1df8a3bb4e82566c","runtime":{"rawSha256":"5dacfff0b325a8f69e3c68f4a257a48eab373ab262c76f96a32249bf30243b4d","relativePath":"runtime-records/candidate/runtime.json"}}},"patch":{"artifact":{"rawSha256":"765ce03210edce79e76188d27ad4ac365f65f4de63133625bf0988add1fbd5ef","relativePath":"candidate.patch"},"changedPaths":["components/spawner/spawner_broken.gd"],"exportReceipt":{"rawSha256":"76781540fa22d772a53b9742c2c8478ad50e078f6b7809e7a0b5b17f600e9668","relativePath":"patch-export-receipt.json"},"identity":{"baselineSourceHash":"3e8bd6478d53586284010da38959005e2a377ef6277b2a838ecb1538abc096e8","byteLength":688,"candidateSourceHash":"92bda3131e95e5db996db13efbd2758b4d14c50846079cde1df8a3bb4e82566c","patchHash":"765ce03210edce79e76188d27ad4ac365f65f4de63133625bf0988add1fbd5ef","patchId":"patch:v1:765ce03210edce79e76188d27ad4ac365f65f4de63133625bf0988add1fbd5ef","schemaVersion":1,"taskId":"task:m5-live-1786508083223"},"roundTripSelectedTreeSha256":"92bda3131e95e5db996db13efbd2758b4d14c50846079cde1df8a3bb4e82566c","roundTripVerified":true},"productSubject":{"clean":true,"repositoryCommit":"896eac0b5f8f1dddec952f341f0fe5299d0967ad","repositoryTree":"892d7bedf094a3179779d614183512556d58ad2d"},"schemaVersion":1,"semanticProfile":{"adapterProfileSha256":"2600ae0d42a463d78a7c74b987799e74e7391c254f806ddbcc86b2256591f0e4","protocolProfile":"chronorift-godot-semantic-v1","targetScene":"res://components/spawner/enemy_spawner_broken.tscn","taskProfile":"godot-external-semantic-v1"},"source":{"baselineSelectedTreeSha256":"3e8bd6478d53586284010da38959005e2a377ef6277b2a838ecb1538abc096e8","declaredUrl":"https://github.com/endlessm/moddable-platformer","gitTreeObjectId":"a013bd677c712dbf354e8e2f6e8ff7c53d5684c6","headCommit":"3e793f53598a131c53fb82555191cc14b8db07ff","hostUnchangedAfterTask":true},"summaryContentSha256":"714d5a5bf040eb32847031eb7e364902ff640c9f0116659d1fa1fe5ccebaa623","taskClassification":"public_exposed_behavior_change_conformance","taskId":"task:m5-live-1786508083223","taskSpecSha256":"c9cb447748b7d4cbd81554fa67c0432e84a9761781de8d7355e5533f16ffb199","toolchain":{"godotVersion":"4.7.1.stable.official.a13da4feb","nodeVersion":"v22.23.1"}}
